,0
0,뱅 드림 천사 님 뱅 드림 천사 님 친드 모시다 자세하다 건 세번 째 사진 읽다 아래 표 작성 하다 후 찌르다 주심 감사하다 트친 분들 인알 부탁드리다
1,뱅 드림 사토 마 스키 마스 킹 굿 즈 처분 판매 하다 사진 별로 묶음 일괄 판매 개별 가격 소 분 용다 디엠 문의 줄다 네 모 표시 미개 봉 미전 시품 일괄 구매 시 슈발츠 장
2,뱅 드림 뱅 드림 로젤리아 이마이 리사 좋아하다 굿 즈 쫌쫌 따리 모으다 시간 나다 그림 오너캐 얘기 해 그림 톤 님
3,뱅 드림 필름 라이브 필라 특전 색 주차 모 르포 카 키 리가 토우코 반택 포 판매 하다
4,나 어리다 때 그림 연습 걸 함 앙 스타 뱅 드림 방법 남캐 잘 그리다 앙 스타 이르다 내 그림 체 그리기 번 여캐 잘 그리다 뱅 드림 이르다 내 그림 체 그리기 번 그래서 진짜 하다 물어보다 두다 합치다 번
5,뱅 드림 쿠라 타 말다 굿 즈 구합 니 아크릴 지류 위주 구 디엠 줄다
6,천사 님 줄다 뱅 드림 천사 님 아야 천사 님 천사 님 모시다 뱅 드림 장르 마루 야마 아야 천사 님 모시다 아래 글 읽다 오다
7,뱅 드림 츄츄 타마 데 치유 라스 위주 굿 즈 위주 파다 일괄 다수 개별 순 우대 하다 하자 예민하다 신분 들 삼가다 해주다 자세하다 디엠 물어보다
8,최소 이상 거래 하다 사진 가격 적히다 전체 적 개봉 후 전시 해 두다 하다 상품 자세하다 하자 확인 하다 디엠 부탁드리다 자세하다 사항 타래 적다 두다 레이 뱅
9,뱅 드림 반 도리 포핀 파티 포 피파 하나조노 타 포핀 드림 앨범 특전 포토 카드 각 판매 양 도합 니 일괄 구매 시 반택 비 부담 하다
10,뱅 드림 굿 즈 마스 킹 모리 체크 모리 척 누 이 구합 니 문의 디엠 부탁드리다
11,뱅 드림 이 치가 아리사 넨도 카페 아크릴 하나조노 타 에이치 가야 아리사 필름 라이브 색 오다 카미 이브 부쿠부 스트랩 기모노 여름 아크릴 판매 하다 일괄 시 운포 문의
12,뱅 드림 반 도리 깔다 돌다 처분 목적 파다 생 이다 오다 크다 히 나 파츠 약 진행 계 퓨 라스 파츠 햎젤 파츠 타래
13,홈스 턱 기력 없다 대학생 트친 해주다 비록 홈스 턱 연성 없다 명 일방 주 소녀 전선 프로 세카 뱅 드림 페 오 블루아 카를 다 고연 성 없다 트친 해주다 데이브 더크 좋아하다
14,뱅 드림 천사 님 모시다 글 뱅 드림 천사 님 모시다 란 천사 님 썸 연 드 다른 천사 분들 친구 드림 모시다 오 시기 전 먼저 에스크 언 질 부탁드리다 란 천사 님 일 이상 가면 알티 추첨 덕 자금 드리다
15,뱅 드림 쿠라 타 말다 굿 즈 구합 니 아크릴 지류 위주 구 디엠 줄다
16,뱅 드림 쿠라 타 말다 굿 즈 구합 니 아크릴 지류 위주 구 디엠 줄다
17,뱅 드림 마츠바 카논 포카 포토 카드 판매 하다 위캔후레 관련 굿즈 판매 의사 철회 되다 수 디엠 문의 줄다
18,올 뱅 님 아키코 하 같다 뱅 드림 컾 들다
19,뱅 드림 마츠바 카논 포카 포토 카드 판매 하다 위캔후레 관련 굿즈 판매 의사 철회 되다 수 디엠 문의 줄다
20,뱅 드림 일 도리 계정 양 도합 니 가끔 게임 하다 정도 이다 랭 성 개 퍼콤작 하다 곳 많다 편하다 디엠 줄다
21,나 어리다 때 그림 연습 걸 함 앙 스타 뱅 드림 방법 남캐 잘 그리다 앙 스타 이르다 내 그림 체 그리기 번 여캐 잘 그리다 뱅 드림 이르다 내 그림 체 그리기 번 그래서 진짜 하다 물어보다 두다 합치다 번
22,소 미자 동 트윗 소 밉다 그림 계 트친 모두 맞팔 하다 타장르 들 많다 주로 아이 카츠 뱅 드림
23,안녕하다 몇 백년 트위터 킵니 앙 스타 뱅 드림 프 세카 하다 마지막 내 새끼 레이 이다 굿 즈 도 사진 꽉차다 못 올리다 어쨋 하트 누르다 팔로 걸다 리듬게임 뱅 드림
24,으 머 정말 사람 차이 보다 ㅜㅜ 친구 앙 스타 프 세카 뱅 드림 셋 다 하다 뱅 드림 가장 어렵다
25,아아 악 맞다 특히 뱅 드림 ㅜ 친구 들 하다 보 진짜 빡세 덥다 보다 봄
26,프 세카 프로 세카 투디 원더 쇼 오시 성인 한 섭 유저 용 루 이 네네 좋아하다 프 세카 외 뱅 드림 얘기 차 창작 하다 무 메다 팔 해
27,코스 어 응애응애 병아리 코스 어 파닥파닥 이다 스파 패 앙 스타 프 세카 뱅 드림 등등 많이 파 남자 코스 어 자다 안 받다 습 니당다 흔적 남기다 찾아가다
28,뱅 드림 레이 맞추다 로 제트 커미션 완료 돼다
29,뱅 드림 반 도리 히 카 사 굿 즈 부쿠부 피 규어 양 도합 니 편하다 문의 줄다
30,뱅 드림 만쥬 로젤리아 니 기 만쥬 시로 카 린코 판매 양도 만지다 적 없다 전시 하다 하자 전혀 없다 상태 이다 구매 의사 분 사진 드리다 디엠 줄다 양 도합 니 반
31,뱅 드림 장터 퓨슾완덱 퓨젤찐팣계 문상 판매 하다 급처 하다 성 개수 개 문의 디엠 부탁드리다 뱅 드림 일 도리 돌다 깔다 돌다 나눔 급구 급처 판매 교환 고 랭 계 퓨젤 퓨슾 찌다
32,뱅 드림 주년 캔 뱃지 판매 지금 합정 애플 샵 오늘 합정 직거래 되다 외 광주 직거래 반택 위주 로만 받다 개다 로 판 매다 받다
33,뱅 드림 장터 뱅 드림 파 레오 굿 즈 판매 가격 사진 속 구매 조건 괄호 숫자 인용 트윗 물건 중 캔 뱃지 제외 함께 구매 해주다 상태 드레스 미개 봉 나머지 단순 개봉
34,뱅 드림 하나조노 타 굿 즈 반택 비 포함 일괄 양도 하다 맘찍후 디엠
35,뱅 드림 로젤리아 히 카 사 넨도로이드 반택 포 처분 양도 판매 하다 크게 눈 띄다 하자 안보 파츠 전부 쿨거시 반택 포 드리다 급전 이다 문의 보다 트윗 맘찍 후 디엠 줄다
36,짐 정리 겸 뱅 드림 굿 즈 싸다 판매 해 히 클리어 타 올 사 요피 규어 개봉 전시 박스 별 반짝 바이스 슈발츠 개다 아야 아크릴 스트랩 뱃지 개다 타래 오픈 채팅 연락 줄다
37,뱅 드림 말다 치어리더 필라 아크릴 판매 하다 각 뱅 드림 장터 몰다 포 굿 즈 양도 매입
38,뱅 드림 리제 오다 크다 웨딩 오다 크다 찐완또 파츠 스티커 계정 구합 니 좀 사고 싶다 은퇴 계 고 랭 계 등등 안 가다 웨딩 앙코르 나오다 옷 말 하다 겁니다
39,일 도리 뱅 드림 반 도리 계정 구합 니당다 레벨 이상 폐광 계 구 하다 히 많다 계정 우대 하다 성 많다 수록 좋다 가격 상관
40,뱅 드림 반 도리 굿 즈 히 카 사 송 아이엠 아크릴 미개 봉 운 밉다 파다 디엠 오픈 채팅 줄다
41,뱅 드림 이 치가 아리사 굿 즈 양도 판매 정리 하다 이상 가격 추가 눌 의향 안 팔리다 걍 소장 하다 후 지큐 아크릴 스탠드 칸타빌레 뱅 애니 주년 샵 뱅 에잇 성 써클 회원 증 부쿠부 캬 리움 개다
42,파스 파레 아야 위주 지류 일괄 판매 하다 일괄 홀리데이 브마 하자 타래 사진 올리다 두다 디엠 줄다 뱅 드림 양도 뱅 드림 장터
43,뱅 드림 츄츄 타마 데 치유 라스 위주 굿 즈 위주 파다 일괄 다수 개별 순 우대 하다 하자 예민하다 신분 들 삼가다 해주다 자세하다 디엠 물어보다
44,뱅 드림 라스 아크릴 핀 즈 아크릴 판매 하다 핀 즈 일괄 아크릴 스탠드 일괄 가지 전부 구매 시 전부 캐릭터 확인 위 단순 개봉 문의 주시 실물
45,뱅 드림 장터 뱅 드림 ㅇㄴ 님 치사 카논 비공식 굿 즈 판매 하다 원가 판매 하다 선착순 명 구매 특전 포함 이다 일괄 로만 판매 하다 개별 문의 배송 편택 반택 이용 하다
46,오다 카미 이브 굿 즈 판매 뱅 드림 파스 파레 히 마야 아야 치사 토 뱅 드림 장터 개 이상 구매 부탁드리다 일괄 구매 우대 하다 전부 개봉 전시 피 규어 박스
47,뱅 드림 반 도리 깔다 돌다 처분 목적 파다 생 이다 오다 크다 히 나 파츠 약 진행 계 퓨 라스 파츠 햎젤 파츠 타래
48,뱅 드림 굿 즈 마스 킹 모리 체크 모리 척 누 이 구합 니 문의 디엠 부탁드리다
49,뱅 드림 미타 케 란 누 이 누 이 구루미 인형 교복 인형 각 판매 양도 하다 전시 해 두 어서 눈 띄다 하자 없다 디엠 물어보다 말씀 드리다 디엠 주시 멘션 맘찍 해주다
50,뱅 드림 로젤리아 시로 카 린코 생일 굿 즈 박스 양도 받다 되다 풀셋 선호 하나 아크릴 개별 도 구매 하다 생각 가격 웬만하다 맞추다 드리다 적다 디엠 부탁드리다 간절하다 구 해보다 반 도리 양도 공
51,뱅 드림 일 도리 돌다 판매 타래 대부분 밉다 진행 계 이다 교환 문의 약 네 가능하다 문의 줄다 페스 돌다 위주 원하다 카드 계정 찾다 드리다 가능하다 거래 전 메인 트 확인 필수
52,뱅 드림 일 도리 반 도리 한도리 계정 판매 양도 쿨 카 위주 키우다 계정 양도 판매 하다 쿨니카팣 페스 치사 토사 만 돌 페스 히 마리 아야카 놓다 백스테 미사 키린코 아리사 문상 교환
53,뱅 드림 굿 즈 판매 하다 현재 급처 씩 낮추다 파다 은 로 늘다 늘다 맘찍후 디엠 문의 줄다 ㅅㅊㅇ 뱅 드림 거래 판매 굿 즈 뱅 드림 굿 즈 판매 양
54,뱅 드림 하나조노 타 부쿠부 아크릴 스탠드 판매 하다 공 계로 디엠 줄다
55,뱅 드림 반 도리 포핀 파티 포 피파 하나조노 타 포핀 드림 앨범 특전 포토 카드 각 판매 양 도합 니 일괄 구매 시 반택 비 부담 하다
56,뱅 드림 반 도리 포핀 파티 포 피파 하나조노 타 포핀 드림 앨범 특전 포토 카드 각 판매 양 도합 니 일괄 구매 시 반택 비 부담 하다
57,뱅 드림 일 도리 반 도리 한도리 계정 판매 양도 쿨 카 위주 키우다 계정 양도 판매 하다 쿨니카팣 페스 치사 토사 만 돌 페스 히 마리 아야카 놓다 백스테 미사 키린코 아리사 문상 교환
58,지금 뱅 드림 하다 창문 보다 밝다 이 맞다 임
59,나 어리다 때 그림 연습 걸 함 앙 스타 뱅 드림 방법 남캐 잘 그리다 앙 스타 이르다 내 그림 체 그리기 번 여캐 잘 그리다 뱅 드림 이르다 내 그림 체 그리기 번 그래서 진짜 하다 물어보다 두다 합치다 번
60,뱅 드림 패치 버블 하다 아야
61,뱅 드림 아오 바 모카 천사 님 모시다 ㅠㅠ 진짜 잘 해드리다 자신 천사 님 어디 계시다 ㅠㅠㅠ 뱅 드리다 바 모카 천사 님 여기
62,니 오시 네 명 모두 좋아하다 중 미즈 키 제일 좋아하다 미즈 루 이 미즈 루 이 네네 마 후카 미즈 마후 미즈 좋아하다 일 세카 계정 잃어버리다 한 세카 해 타 장르
63,올해 목표 뱅 드림 전곡 풀콤 스페셜 제외 ㅋㅋ 노스 그레이드 투덱 단 ㅋ 기타 등등
64,뱅 드림 반 도리 일 도리 한도리 계정 판매 양도 콜라보 라스 오다 크다 아야 웨딩 의상 칭호 핀츠 내리다
65,뱅 드림 사실 이 거 몇개 월 만 하다 개월 만인 것 같다 마침 또 햎젤리 이벵임
66,우익 병크 터지다 모르다 뱅 드림 프 세카 앙 스타 피 로스 추천
67,자동 트윗 모카 란뱅 드림 안코 하프 세카 메인 커플링 두다
68,뱅 드림 레즈 뵤들 파티
69,뱅 드림 레즈 뵤들 파티
70,뱅 드림 레즈 뵤들 파티
71,루미너스 뱅 드림 최강
72,루미너스 뱅 드림 최강
73,루미너스 이기다 곡 없다 생각 해 솔직하다 밴드 라스 뱅 드림 최애 곡
74,약간 뱅 드림 지금 잘 돼다 오늘 자다 글럿다
75,뱅 드림 요즘 너무 접속 안 하다 허허
76,사퍼 뱅 드림 본진 이다 서울 인천 주로 출몰 하다 뭔가 낮 익다 트친 츄 라이 츄 라이 흔적 남기다 ㅌㅊㅅ
77,뱅 드림 프로 세카 로 모 의 일지 패러디 폰트 찾다 글자 입력 해주다 빰님 무한 감사 올리다
78,뱅 드림 마츠바 카논 포카 포토 카드 판매 하다 위캔후레 관련 굿즈 판매 의사 철회 되다 수 디엠 문의 줄다
79,뱅 드림 곡 이름 말 한 거얏 늘다 대응
80,뱅 드림 반 도리 포핀 파티 포 피파 하나조노 타 포핀 드림 앨범 특전 포토 카드 각 판매 양 도합 니 일괄 구매 시 반택 비 부담 하다
81,뱅 드림 좀비랜드 사가 리벤지 콜라보 로그인
82,대단하다 난 지금 뱅 드림 조지 잇다 말 그대로 조지 잇다
83,뱅 드림 프 세카 앙 스타 다 하다 뭘 원하다
84,뱅 드림 하다 분 없다 다 들다 프 세카 하
85,프 세카 프로 세카 투디 원더 쇼 오시 성인 한 섭 유저 용 루 이 네네 좋아하다 프 세카 외 뱅 드림 얘기 차 창작 하다 무 메다 팔 해
86,뱅 드림 세타 카오루 로미오 부르다 신나다 카오루 그걸 지켜보다 아기 고양이 들
87,뱅 드림 프로 세카 로 모 의 일지 패러디 폰트 찾다 글자 입력 해주다 빰님 무한 감사 올리다
88,뱅 드림 프로 세카 로 모 의 일지 패러디 폰트 찾다 글자 입력 해주다 빰님 무한 감사 올리다
89,뱅 드림 친구 하다 사람
90,뱅 드림 거유 들 ㄹㅇ 묵직하다 느낌 프세카 그렇다 없다 대신 혼 모노 빈유 잘 보이다 건 조음
91,나 어리다 때 그림 연습 걸 함 앙 스타 뱅 드림 방법 남캐 잘 그리다 앙 스타 이르다 내 그림 체 그리기 번 여캐 잘 그리다 뱅 드림 이르다 내 그림 체 그리기 번 그래서 진짜 하다 물어보다 두다 합치다 번
92,뱅 드림 익스 다깨놧 던 계정 지우다 후회 중
93,뱅 드림 기념 이르다 들다 너무 좋다 옛날 거가 특히
94,년도 뱅 드림 이르다 스타일 좋아하다 유리 깔끔하다 반짝거리다 섬세하다 그림 체
95,아니다 뱅 드림 노래 좋다 건 다 너무 어렵다 깨다 함 ㅁ
96,뱅 드림 프로 세카 로 모 의 일지 패러디 폰트 찾다 글자 입력 해주다 빰님 무한 감사 올리다
97,뱅 드림 로젤리아 시로 가다 린코 위고 아크릴 판매 하다 편하다 디엠 줄다
98,프 세카 뱅 드림 풀콤 대리 작 첫 문의 주다 맘찍 주시 감사하다 오픈 채팅 방 문의 주시 것 보다 이 읽다 쉽다 그래도 혹시 모르다 링크 남다
99,걍 택포 가져가다 분 뱅 드림 모 르포 카 후 타바 츠쿠시 마루이 아크릴 스탠드 판매 양도 거래 전 디자인 혹 하다 만원 대 구 매 햇 엇어 구 하다 힘들다 흔적 남기다 디엠 줄다 아 묻다 따다 쿨거
100,타장르 언급 뱅 드림 앙 스타
101,뱅 드림 프 세카 앙 스타 순 시작 하다 뱅 드림 프세카 스무 스 한 데 앙 스타 너무 어렵다
102,저 앙 스타 남돌 뱅 드림 여고생 밴드 부쪽
103,뱅 드림 장터 뱅 드림 로젤리아 아크릴 스트랩 가챠 이마이 리사 미개 봉 배 밉다 포 일괄
104,뱅 드림 브리키 댄스 그렛 얘 그렛 어디서 많이 뜨다 브리키 오다 잡다 ㅋㅋㅋㅋㅋ
105,나 어리다 때 그림 연습 걸 함 앙 스타 뱅 드림 방법 남캐 잘 그리다 앙 스타 이르다 내 그림 체 그리기 번 여캐 잘 그리다 뱅 드림 이르다 내 그림 체 그리기 번 그래서 진짜 하다 물어보다 두다 합치다 번
106,진심 버스 안 뱅 드림 풀콤 치다 멀미 안남
107,뱅 드림 모 르포 카 말다 위주 굿 즈 판매 하다 개별 뱃지 뱃지 으 로 구매 해주다 테루테루보즈 키링 필름 라이브 아크릴 스탠드 라이브 뱃지
108,뱅 드림 굿 즈 판매 하다 현재 급처 씩 낮추다 파다 은 로 늘다 늘다 맘찍후 디엠 문의 줄다 ㅅㅊㅇ 뱅 드림 거래 판매 굿 즈 뱅 드림 굿 즈 판매 양
109,뱅 드림 일 도리 돌다 판매 타래 대부분 밉다 진행 계 이다 교환 문의 약 네 가능하다 문의 줄다 페스 돌다 위주 원하다 카드 계정 찾다 드리다 가능하다 거래 전 메인 트 확인 필수
110,뱅 드림 와카 레이 레이 포토 카드 아크릴 키링 소 분하다 일괄 받다 메루 카리 구매 상품 이다 차금 남다 메루 카리 특성 자다 알 계시다 분만 참여 부탁드리다 차금 라스 레
111,야 너 혹시 뱅 드림 해 저 가방 속 로젤리아 응원봉 쥐 그렇다 씹덕 겜 왜 하다 둥 말 꺼내다 살해 하다 생각 이다 하지만 나 히 마리 너무 좋다 야 잘 돼다 협라할
112,뱅 드림 파 레오 뉴 바라다 레오나 굿 즈 판매 하다 다수 구매 우대 하다 티켓 풍 스티커 별 뱃지 메탈 챰 부쿠부 로손 아크릴 스탠드 주년 트레이딩 뱃지 별 키링 클립
113,뱅 드림 일 도리 계정 구해 계정 날리다 아래 롯 카리 살다 꼭 계정 거나 다른 멤버 불젤 파츠 좋다 스토리 다 열람 오히려 좋다 퀘스트 완료 괜찮다 플레이 하다 수
114,뱅 드림 레이 와카 레이 굿 즈 판매 하다 필름 라이브 특전 장 일괄 미니 피 규어 개 일괄 두 물품 일 괄시 드리다 공 계로 디엠 줄다
115,자동 트윗 미타 케 란뱅 드림 히노 모리 시 호프 세카 최애 두다
116,젠 뱅 드림 안 해봤다 슴 다
117,들다 뱅 드림 하다 싶다 ㅋ 님 과제 언제 하다 요
118,뱅 드림 하나조노 타 부쿠부 아크릴 스탠드 판매 하다 공 계로 디엠 줄다
119,권 실장 말다 채다 린지 김 배우 부모님 살다 남자 밉다 남자 싫다 죽여주다 뱅 드림 같이 해주다 에어팟 왼쪽 귀 끼다 미안하다 사랑 하다
120,앗 혹시 메인트 사용 하다 소 개표 분 계시다 뱅 드림 프 세카 소 개표 찾다
121,프 세카 뱅 드림 둘 다 하다 다 한 섭 함
122,너무나 크다 충격 그만 틔터 들어오다 아니다 실화 고 뱅 드림 한정 뽑기 무기한 그거 리사 노리 또 돌리다 무지개 심지어 리사 실루엣 뜨다 미치다 외치다 뽑다
123,나 어리다 때 그림 연습 걸 함 앙 스타 뱅 드림 방법 남캐 잘 그리다 앙 스타 이르다 내 그림 체 그리기 번 여캐 잘 그리다 뱅 드림 이르다 내 그림 체 그리기 번 그래서 진짜 하다 물어보다 두다 합치다 번
124,나 어리다 때 그림 연습 걸 함 앙 스타 뱅 드림 방법 남캐 잘 그리다 앙 스타 이르다 내 그림 체 그리기 번 여캐 잘 그리다 뱅 드림 이르다 내 그림 체 그리기 번 그래서 진짜 하다 물어보다 두다 합치다 번
125,비계 팅 투디 단간론파 프세카데레스 테뱅 드림 비계 선팔
126,뱅 드림 돌다 대행 만 돌다 바이오 오픈 채팅 문의 줄다 ㅅㅊㅇ 뱅 드림 반 도리 대리 판매 구매 대다 풀콤작 쿨 피파 찐완 찐완덱 올 한정 한정 페스 드페 키페 키라 페스 돌다 대행 구함 구해
127,뱅 드림 틧할때 협 하 재다 ㅋㅋㅋㅋ 걍 겜창 언니
128,뱅 드림 필름 라이브 레이 특전 양 도합 니 운 밉다 우편 준 등기 반택 이다 디엠 오류로 꼭 멘션 함께 남기다 빠르다 확인 가능하다
129,뱅 드림 굿 즈 판매 하다 현재 급처 씩 낮추다 파다 은 로 늘다 늘다 맘찍후 디엠 문의 줄다 ㅅㅊㅇ 뱅 드림 거래 판매 굿 즈 뱅 드림 굿 즈 판매 양
130,뱅 드림 굿 즈 판매 하다 현재 급처 씩 낮추다 파다 은 로 늘다 늘다 맘찍후 디엠 문의 줄다 ㅅㅊㅇ 뱅 드림 거래 판매 굿 즈 뱅 드림 굿 즈
131,뱅 드림 일 도리 반 도리 한도리 계정 판매 양도 쿨 카 위주 키우다 계정 양도 판매 하다 쿨니카팣 페스 치사 토사 만 돌 페스 히 마리 아야카 놓다 백스테 미사 키린코 아리사 문상 교환
132,뱅 드림 일 도리 돌다 판매 타래 대부분 밉다 진행 계 이다 교환 문의 약 네 가능하다 문의 줄다 페스 돌다 위주 원하다 카드 계정 찾다 드리다 가능하다 거래 전 메인 트 확인 필수
133,뱅 드림 로젤리아 시로 카 린코 생일 굿 즈 박스 양도 받다 되다 풀셋 선호 하나 아크릴 개별 도 구매 하다 생각 가격 웬만하다 맞추다 드리다 적다 디엠 부탁드리다 간절하다 구 해보다 반 도리 양도 공
134,한국어 자막 뱅 드림 애니메이션 애니플러스 보다
135,뱅 드림 굿 즈 파다 다 팔리다 알티 해주다 분들 중 하다 분 뽑다 드리다 부터 거래 하다 궁금하다 점 연락 줄다 반택 편택
136,뱅 드림 사 마 스키 나 나미 오시 그런데 요즘 레이 너무 좋다 오다 캐다 이다 고삼 접률 보장 힘들다 그래도 함께 해주다 분 모시다 리겜 장르 위주 타장르 섞이다
137,뱅 드림 반 도리 레이즈 스이렌 라스 포카 교환 양도 와카 레이 레이 사토 마 스키 마스 킹 타마 데 치유 츄츄 뉴 바라다 레오나 파 레오 아사히 롯카 록
138,뱅 드림 레이즈 스이렌 라스 포카 교환 구합 니 저 세 크리드 월드 록 세 크리드 월드 레이 교환 아니다 레이 포카 판매 받다 찌르다 디엠 후 멘션 부탁드리다
139,뱅 드림
140,뱅 드림 일 도리 반 도리 한도리 계정 판매 양도 쿨 카 위주 키우다 계정 양도 판매 하다 쿨니카팣 페스 치사 토사 만 돌 페스 히 마리 아야카 놓다 백스테 미사 키린코 아리사
141,반 도리 일 도리 뱅 드림 한정 페스 돌다 판매 대행 주년 드림 페스 포함 계정 사진 타래 확인 구매 문의 사진 혹은 번호 함께 연락 주 시기 바라다
142,아 ㅁㅊ 하필 뱅 드림
143,나 뱅 드림 접속 아예 안 돼다
144,비계 팅 투디 단간론파 프세카데레스 테뱅 드림 비계 선팔
145,리겜 하나 하다 싶다 프세카 뱅 드림 중 고민
146,나 어리다 때 그림 연습 걸 함 앙 스타 뱅 드림 방법 남캐 잘 그리다 앙 스타 이르다 내 그림 체 그리기 번 여캐 잘 그리다 뱅 드림 이르다 내 그림 체 그리기 번 그래서 진짜 하다 물어보다 두다 합치다 번
147,비계 팅 러브라이브 샤니 마스 프 세카 주력 외 데레스테 아이 프라 원 신 두근두근 문 예부 단간론파 파라 라이 뱅 드림 하다 러브 이 버 환영 제발 가끔 공 계로 돌리다 선팔 주시 바로 맞팔 해드리다
148,프 세카 프로 세카 투디 원더 쇼 오시 성인 한 섭 유저 용 루 이 네네 좋아하다 프 세카 외 뱅 드림 얘기 차 창작 하다 무 메다 팔 해
149,프 세카 프로 세카 투디 원더 쇼 오시 성인 한 섭 유저 용 루 이 네네 좋아하다 프 세카 외 뱅 드림 얘기 차 창작 하다 무 메다 팔 해
150,프 세카 프로 세카 투디 원더 쇼 오시 성인 한 섭 유저 용 루 이 네네 좋아하다 프 세카 외 뱅 드림 얘기 차 창작 하다 무 메다 팔 해
151,뱅 드림 ㅅㅂ 노답 하다 그만 둿 어
152,뱅 드림 사 마 스키 나 나미 오시 그런데 요즘 레이 너무 좋다 오다 캐다 이다 고삼 접률 보장 힘들다 그래도 함께 해주다 분 모시다 리겜 장르 위주 타장르 섞이다
153,나 어리다 때 그림 연습 걸 함 앙 스타 뱅 드림 방법 남캐 잘 그리다 앙 스타 이르다 내 그림 체 그리기 번 여캐 잘 그리다 뱅 드림 이르다 내 그림 체 그리기 번 그래서 진짜 하다 물어보다 두다 합치다 번
154,뱅 드림 반 도리 일 도리 도리 베다 오다 크다 돌다 판매 하다 가챠 외 다르다 건드리다 않다 각각
155,뱅 드림 일일 카페 수요 조사 주인 님 들다 모시다 인수 메이드 로젤리아 궁금하다 않다 가요 특별하다 대접 하다 드리다 어서 오다 주인 님 년 봄 계최 예정 한 타임 진행 손님
156,뱅 드림
157,자동 트윗 뱅 드림 프 세카 장르 계 이다 타장르 불편하다 분 들 블언블 썰다
158,나 어리다 때 그림 연습 걸 함 앙 스타 뱅 드림 방법 남캐 잘 그리다 앙 스타 이르다 내 그림 체 그리기 번 여캐 잘 그리다 뱅 드림 이르다 내 그림 체 그리기 번 그래서 진짜 하다 물어보다 두다 합치다 번
159,뱅 드림 로젤리아 시로 카 린코 생일 굿 즈 박스 양도 받다 되다 풀셋 선호 하나 아크릴 개별 도 구매 하다 생각 가격 웬만하다 맞추다 드리다 적다 디엠 부탁드리다 간절하다 구 해보다
160,투디 투디 만화책 보다 거 좋아하다 뱅 드림 프 세카 앙 스타 아이 나나 히프 마이 프리 다양하다 장르 파다
161,뱅 드림 아오 바 모카 천사 님 모시다 ㅠㅠ 진짜 잘 해드리다 자신 천사 님 어디 계시다 ㅠㅠㅠ 뱅 드리다 바 모카 천사 님 여기
162,뱅 드림 사토 마 스키 마스 킹 굿 즈 처분 판매 하다 사진 별로 묶음 일괄 판매 개별 가격 소 분 용다 디엠 문의 줄다 네 모 표시 미개 봉 미전 시품 일괄 구매 시 슈발츠
163,홈스 턱 기력 없다 대학생 트친 해주다 비록 홈스 턱 연성 없다 명 일방 주 소녀 전선 프로 세카 뱅 드림 페 오 블루아 카를 다 고연 성 없다 트친 해주다 데이브 더크 좋아하다
164,뱅 드림 하나 미치다 자본 맵다 ㅋㅋㅋㅋㅋㅋㅋㅋㅋㅋ 디포 디제 올라가다
165,뱅 드림 미타 케 란 누 이 누 이 구루미 인형 교복 인형 각 판매 양도 하다 전시 해 두 어서 눈 띄다 하자 없다 디엠 물어보다 말씀 드리다 디엠 주시 멘션 맘찍 해주다
