,0
709,나 어리다 때 그림 연습 걸 함 앙 스타 뱅 드림 방법 남캐 잘 그리다 앙 스타 이르다 내 그림 체 그리기 번 여캐 잘 그리다 뱅 드림 이르다 내 그림 체 그리기 번 그래서 진짜 하다 물어보다 두다 합치다 번
710,뱅 드림 굿 즈 판매 하다 급전 필요하다 파다 롯카 일괄 치사 토 유라 링 동 앨범 애니메이트 스티커 일괄 파 레오 캔 뱃지 일괄
711,나 어리다 때 그림 연습 걸 함 앙 스타 뱅 드림 방법 남캐 잘 그리다 앙 스타 이르다 내 그림 체 그리기 번 여캐 잘 그리다 뱅 드림 이르다 내 그림 체 그리기 번 그래서 진짜 하다 물어보다 두다 합치다 번
712,뱅 드림 반 도리 한도리 라스 레이 와카 레이 아크릴 위주 양도 판매 공구 분철 설명 타래 기재 되어다 가격 씩 내리다 디엠 줄다 레이 홀리 데
713,뱅 드림 코코 성 아크릴 스탠드 양도 판매 하다 미개 봉품 반택 편택
714,뱅 드림 신년 카 스미다 뽑다 스타 모으다 중
715,나 뱅 드림 접 엇 늘다
716,뱅 드림 뱅 드림 로젤리아 이마이 리사 좋아하다 굿 즈 쫌쫌 따리 모으다 시간 나다 그림 오너캐 얘기 해 그림 톤 님
717,찾아보다 나오다 한국 음원 사이트 들다 수 노래 들 우 타 프리 비프 뱅 드림 히프 마이 파라 라이 아르고 나비스 생각 많다 듯 앙 스타 없다 따로 앨범 사다 되다
718,이번 이벤트 뱅 드림 캐릭터 학년 바뀌다 엇 나다
719,뱅 드림 일 도리 돌다 판매 하다 투 페스 페스 한정 한정 돌다 다수 판매 하다 존버타시 운 좋다 찐완 만들다 돌다 들다 보유 중 계정 개 판매 되다 때 하 신분 들 중 분 만 돌 계 하나 씩 나눔 하다 습
720,나 어리다 때 그림 연습 걸 함 앙 스타 뱅 드림 방법 남캐 잘 그리다 앙 스타 이르다 내 그림 체 그리기 번 여캐 잘 그리다 뱅 드림 이르다 내 그림 체 그리기 번 그래서 진짜 하다 물어보다 두다 합치다 번
721,끌 오다 뱅 드림 뱅 드림 뱅 드림 추가 컾링 예민하다 분도 피 해주다 유키 란 안 먹다 여자 만나다 싶다 트윗 싸지르다 남성 걸다 받다 다음주 시험 끝나다 한번 받다
722,손 이 가요 밴드 팡슬 림 캐릭터 카드 지갑 포캣 아이폰 케이스 그리다 스트랩 폰 홀더 스탠드 핑크 파트너 스 활동 수수료 받다
723,크다 뱅 드림 이제 가챠 픽업 성 두 명 포보 명함 명 나머지 둘 투디 의상 준 달다 거징 이르다 개 의상 개
724,뱅 드림 랭킹 마지막 뛰다 올해 월 랭킹 뛰다 거 빼다 맨날 포보 명함 따다 다음 이벤 뜰 때 아예 안 들어가다 ㅋㅋㅋㅋㅋ
725,오타꾸 류 오늘 뱅 드림 후드 집업 입다 헤헤
726,나 어리다 때 그림 연습 걸 함 앙 스타 뱅 드림 방법 남캐 잘 그리다 앙 스타 이르다 내 그림 체 그리기 번 여캐 잘 그리다 뱅 드림 이르다 내 그림 체 그리기 번 그래서 진짜 하다 물어보다 두다 합치다 번
727,다 들다 새끼 오타쿠 때뭐 팔다 뱅 드림
728,뱅 드림 반 도리 일 도리 계정 판매 로젤리아 불젤 찌다 완덱
729,헉 ㅌㅌㅌㅌㅌㅌㅌㅌ 오다 오랜 만이 ㅠㅠㅠㅠㅠ 공 쥬 들 또 뱅 드림 하다
730,추첨 모두 양도 되다 추첨 통해 소소하다 덕질 자금 입금 드리다 뱅 드림 이 치가 아리사 아크릴 판매 하다 방 나인 홀리데이 개다 아스 하 모개 당 멘션 디엠 ㅅㅊㅇ 뱅 드림
731,원래 전신 브로콜리 떨어지다 나오다 뱅 가드 류 딱 지 게임 여러 미디어 컨텐츠 개발 중 만들어지다 부시 로드 이다 뱅 드림 프로젝트 개발 설화 보다 일본 프로레슬링 빼놓다 수 없다
732,뱅 드림 재밌다
733,뱅 드림 스트랩 뱃지 지류 특전 판매 멘션 또는 디엠 줄다 가격 사진 참고 ㅅㅊㅇ 히 마리 모카 하 구미 마스 킹 헬로 해피 로젤리아
734,뱅 드림 장터 아리사 프라 이즈 누 이 판매 하다 메다 칼 제품 이다 보기 하자 없다 보이 민감하다 분 구매 지 양해 줄다 ㅅㅊㅇ 뱅 드림 반 도리 포 피파 굿 즈 아리사 누 이 프라 이즈 양도 구매 판매 급처
735,뱅 드림 일 도리 퓨 라스 찐완덱 계정 판매 만 돌 곡 미만 진행 도리 베다 수영복 의상 포보 오다 크다 할로윈 롯카 카 스미다 보유 도리 베다 칭호 핀 즈 오다 크다 보유 즉입 가능하다 때 연락 줄다
736,뱅 드림 반 도리 일 도리 계정 판매 하다 라스 수영복 의상 오다 크다 도리 베다 콜라보 의상 칭호 핀 즈 오다 크다 모든 스토리 열람 노래 얼마 안 치다 스테이지 채다 린지 라스 아야 웨딩 의상 의상 많다 로 판매
737,뱅 드림 장터 아리사 프라 이즈 누 이 판매 하다 메다 칼 제품 이다 보기 하자 없다 보이 민감하다 분 구매 지 양해 줄다 ㅅㅊㅇ 뱅 드림 반 도리 포 피파 굿 즈 아리사 누 이 프라 이즈 양도 구매 판매
738,반 도리 일 도리 뱅 드림 한정 페스 돌다 판매 대행 주년 드림 페스 포함 계정 사진 타래 확인 구매 문의 사진 혹은 번호 함께 연락 주 시기 바라다
739,저번 키라 페스 오다 크다 만 돌 양 도합 니 ㅅㅊㅇ 뱅 드림 일 도리 반 도리 방 도리 깔다 돌다 리세 계 미진 행 계정 판매 양도 파스 파레 팟팔 앱글 애프터 글 로우 몰다 포 모니카 모 르포 카 키라 페스 토모 말다 한정 아야 마야 웨딩
740,이 사람 거짓말쟁이 내 돈 훔치다 간다 빨리 내 돈 갚다 빨리 신고 하다 나 이 사람 거짓말쟁이 것 증명 하다 수 탑 로더 탑 꾸다 드림 방탄 세븐 틴 더보이즈 앙 스타 파샤 뱅 드림 엔시 티
741,나 어리다 때 그림 연습 걸 함 앙 스타 뱅 드림 방법 남캐 잘 그리다 앙 스타 이르다 내 그림 체 그리기 번 여캐 잘 그리다 뱅 드림 이르다 내 그림 체 그리기 번 그래서 진짜 하다 물어보다 두다 합치다 번
742,뱅 드림 친추 하다 트친분 계시다
743,이 사람 거짓말쟁이 내 돈 훔치다 간다 빨리 내 돈 갚다 빨리 신고 하다 나 이 사람 거짓말쟁이 것 증명 하다 수 탑 로더 탑 꾸다 드림 방탄 세븐 틴 더보이즈 앙 스타 파샤 뱅드
744,나 어리다 때 그림 연습 걸 함 앙 스타 뱅 드림 방법 남캐 잘 그리다 앙 스타 이르다 내 그림 체 그리기 번 여캐 잘 그리다 뱅 드림 이르다 내 그림 체 그리기 번 그래서 진짜 하다 물어보다 두다 합치다 번
745,뱅 드림 재활 하다 감
746,아니다 헐다 앞 뱅 드림 열심히 하다
747,나 어리다 때 그림 연습 걸 함 앙 스타 뱅 드림 방법 남캐 잘 그리다 앙 스타 이르다 내 그림 체 그리기 번 여캐 잘 그리다 뱅 드림 이르다 내 그림 체 그리기 번 그래서 진짜 하다 물어보다 두다 합치다 번
748,던 친소 찌다 따다 목화 복실복실하다 모카 하다 스팩 업 기념 돌리다 이다 상던 주다 레이드 같이 돌리다 분 교류 하다 분 환영 하다 덕질 하다 편 뱅 드림 앱글 오시
749,뱅 드림 장터 뱅 드림 포핀 파티 토 야마 카 스미다 위고 아크릴 스탠드 굿 즈 재고 개 남다 운 밉다 판매 양 도합 니 미개 봉 상태 좋다 현물 이다 바이오 링크 확인 후 디엠 문의 부탁드리다
750,저번 키라 페스 오다 크다 만 돌 양 도합 니 ㅅㅊㅇ 뱅 드림 일 도리 반 도리 방 도리 깔다 돌다 리세 계 미진 행 계정 판매 양도 파스 파레 팟팔 앱글 애프터 글 로우 몰다 포 모니카 모 르포 카 키라 페스 토모 말다
751,던 친소 찌다 따다 목화 복실복실하다 모카 하다 스팩 업 기념 돌리다 이다 상던 주다 레이드 같이 돌리다 분 교류 하다 분 환영 하다 덕질 하다 편 뱅 드림 앱글 오시
752,나 어리다 때 그림 연습 걸 함 앙 스타 뱅 드림 방법 남캐 잘 그리다 앙 스타 이르다 내 그림 체 그리기 번 여캐 잘 그리다 뱅 드림 이르다 내 그림 체 그리기 번 그래서 진짜 하다 물어보다 두다 합치다 번
753,뱅 드림 아마도 파레 츄츄 카스 아리
754,진짜 눈물나다 다행 점 뱅 드림 쿨앱글 시즌 거 쿨앱 종합 력 만
755,그렇다 보다 뱅 드림 하다 안 친 곡 치다
756,뱅 드림 일 도리 돌다 판매 하다 투 페스 페스 한정 한정 돌다 다수 판매 하다 존버타시 운 좋다 찐완 만들다 돌다 들다 보유 중 계정 개 판매 되다 때 하 신분 들 중 분 만 돌 계 하나 씩 나눔 하다 습
757,자기 소 개표 앙 스타 프 세카 뱅 드림 디포 디제 따로
758,뱅 드림 굿 즈 양도 판매 일반 택배 원 끼리 택배 원 각 금액 사진 참고 지류 따로 개봉 표시 없다 물품 제외 모두 밉다 개봉 이다 다수 구매 우대 하다 물품 금액 이상 거래 합
759,뱅 드림 굿 즈 양도 판매 ㅅㅊㅇ 써클 회원 증 아크릴 성 월드 페어 플라워 위고 코미케 디오라마 모리 체크 스쿨데이즈 피 규어 포카 슈발츠 스티커 누 이 코 로콧 토 필름 라이브 특전 타 리미 사 아야 란 모카
760,뱅 드림 굿 즈 양도 소 분 위고 슈발츠 클리어 카드 아크릴 스탠드 키링 만쥬 부쿠부 피 규어 아쿠스타 마루이 유카타 캔 뱃지 스쿨데이즈 써클 회원 증 로젤리아 아코 유키나 사 린코
761,자기 소 개표 앙 스타 프 세카 뱅 드림 디포 디제 따로
762,뱅 드림 수업 하다 유키나 리사 만화
763,흠 프 세카 뱅 드림 조금 롤 켜다
764,다 들다 새끼 오타쿠 때뭐 팔다 프리 파라 아이엠 스타 좀비 뱅 드림 생각 꽤 많이 덕질 하다
765,다 들다 새끼 오타쿠 때뭐 팔다 살 선물 공룡 디보 따개비 루 뽀롱뽀롱 뽀로로 살 프리 티 리듬 오로라 드림 아이엠 스타 살 이누야샤 나츠메 우 인장 살살 앙상블 스타즈 뱅 드림 걸즈 밴드 파티
766,나 어리다 때 그림 연습 걸 함 앙 스타 뱅 드림 방법 남캐 잘 그리다 앙 스타 이르다 내 그림 체 그리기 번 여캐 잘 그리다 뱅 드림 이르다 내 그림 체 그리기 번 그래서 진짜 하다 물어보다 두다 합치다 번
767,반 도리 일 도리 뱅 드림 한정 페스 돌다 판매 대행 주년 드림 페스 포함 계정 사진 타래 확인 구매 문의 사진 혹은 번호 함께 연락 주 시기 바라다
768,뱅 드림 앱글 슈발츠 장 일괄 판매 하다 왼쪽 네 장 홀로그램 애니메이트 특전 모카 스티커 같이 드리다 애프터 글 로우 미타 케 란 아오 바 모 우 다가오다 토모 우 하라 히 마리 하자 츠 구미 아크릴
769,뱅 드림 포핀파 슈발츠 뱅 가드 장 일괄 판매 하다 애니메이트 월드 페어 특전 플라워 카 스미다 포함 토 야마 카 스미다 야마 부키 사 아야 이 치가 아리사 우시 메 리미 하나조노 타 포 피파 포핀 파티 포카 앨
770,뱅 드림 마루 야마 아야 위주 캔 뱃지 판매 하다 일괄 개별 구매 하다 때 아야 개 다른 멤버 뱃지 개 데려가다 하다 이브 아크릴 스티커 예 용 파스 파레 우 다가오다 아코 붉다 날개 위고 토 야마 카 스미다 필
771,뱅 드림 장터 뱅 드림 라스 굿 즈 다수 판매 하다 뱅 드림 굿 즈 판매 양 공구 소 분 구매 사다 매입 파 레오 캔 뱃지 마스 킹 사토 마스 키부 쿠 부스 트랩 레이 와카 레이 포토 카드 포카 쿠션 지류 아크릴 멀티 클리 너 성우 라이브 티켓 키링무드 등기 타 피크 주년
772,뱅 드림 일 도리 퓨 라스 찐완덱 계정 판매 만 돌 곡 미만 진행 도리 베다 수영복 의상 포보 오다 크다 할로윈 롯카 카 스미다 보유 도리 베다 칭호 핀 즈 오다 크다 보유 즉입 가능하다 때 연락 줄다
773,뱅 드림 이브 란 슈발츠 카드 일괄 양 도합 니 준 밉다 포 가격 이다 반택 가능하다
774,뱅 드림 아오 바 모카 주년 아크릴 스탠드 공구 양도 하다 배송지 변경 차금 해배 비국배비 포함 양도 하다
775,뱅 드림 장터 뱅 드림 슈발츠 일괄 양 도합 니 미사 키 슈발츠 홀로그램 이다 헬로 해피 미셸 카논 타 이브 바이스 슈발츠 뱅 가드 아크릴 굿 즈 뱃지 별 뱃지 레어 팝핀 파 파스 파레 위고 홀리데이 특전 부쿠부 사 아
776,뱅 드림 일 도리 돌다 판매 하다 투 페스 페스 한정 한정 돌다 다수 판매 하다 존버타시 운 좋다 찐완 만들다 돌다 들다 보유 중 계정 개 판매 되다 때 하 신분 들 중 분 만 돌 계 하나 씩 나눔 하다 습
777,뱅 드림 장터 뱅 드림 코코 루이 리사 별 뱃지 각 양 도합 니 전체 일괄 시 준포 ㅅㅊㅇ 뱅 드림 유키나 사 아야 치사 토 굿 즈 아크릴 특전 지류 뱅 가드 뱃지 이브 카논 디오라마 걸파 리사 모 르포 카 모니카 캔 뱃지
778,뱅 드림 일 도리 초반 계 판매 하다 렙 만 돌 키라 페스 말다 도리 베다 콜라보 오다 크다 한정 아야 마야 계정 판매 하다 맘찍 후 디엠 줄다
779,뱅 드림 파스 파레 오다 카미 이브 위고 아크릴 개봉 전시품 양도 하다 반택 포 디엠 줄다 눈 보이다 하자 없다 사진 속 치마 흰색 점 먼지 이다
780,뱅 드림 파 레오 카페 후 지큐 홀리데이 아크릴 굿 즈 판매 하다 디엠 알림 오지 않다 디엠 후 마음 멘션 하다 번 씩 부탁드리다
781,뱅 드림 카 스미다 위주 아크릴 캔 뱃지 다양하다 굿 즈 판매 하다 대부분 밉다 개봉 배송 일반 택배 반값 택배 준 등기 가능하다 디엠 줄다
782,뱅 드림 카스 미아 리사 카오루 피 규어 넨도 경단 인형 서클 회원 증 구합 니 심하다 플미 제외 자잘하다 기스 하자 전부 괜찮다 되다 이면 원가 사고 싶다 아니다 좋다 찌르다 보다
783,뱅 드림 하나조노 타 굿 즈 판매 하다 카 스미다 타 방과후 키링 타 생일 특전 타 별 아크릴 개 타 성 아크릴 타 소라 콜라보 키링 타 아크릴 개봉 전시
784,뱅 드림 반 도리 아사히 롯카 록 굿 즈 양도 판매 사진 속 금액 모두 운 밉다 포 가격 이다 라우 크레 미개 봉 다음 주 내 수령 예정 주년 아크릴 차금 차금 곧 지불 예정 시즌 아크릴 하자
785,뱅 드림 일 도리 은퇴 계 판매 하다 성 개 한정 개 페스 개 완덱 햅글 불글 퓨글 햅젤 파츠 쿨글 불 스파 레 퓨스 파레 불 피파 불로 하피 불젤 앱글 오 시계 이다 햅글 불글 퓨글 종합 력 만 넘다
786,뱅 드림 굿 즈 다수 양도 하다 개별 다수 일괄 순 확정 조금 오래 걸리다 수 참고 하다 줄다 구매 확실하다 분 아니다 글 흔적 남다 말 줄다 개별 아크릴 하나 당 지류 캔 뱃지 키링 중 다수 포함 하다 문의 주
787,나 어리다 때 그림 연습 걸 함 앙 스타 뱅 드림 방법 남캐 잘 그리다 앙 스타 이르다 내 그림 체 그리기 번 여캐 잘 그리다 뱅 드림 이르다 내 그림 체 그리기 번 그래서 진짜 하다 물어보다 두다 합치다 번
788,뱅 드림 히 카 히 사 위고 성 방 나인 홀로 라이브 아크릴 스탠드 루미너스 큐마 플 포카 코미케 디오라마 판매 양도 하다 디엠 줄다
789,뱅 드림 모 르포 카 하모니 데이 후 타바 츠쿠시 루미너스 마루 야마 아야 라스 아사히 롯카 록 포핀 파티 브로마이드 판매 양도 하다 디엠 줄다
790,뱅 드림 헬로 해피 헬햎 세타 카오루 포토 카드 백스테 스티커 판매 양 도합 니 백스테 스티커 포카 개다 고 전체 일 괄시 반택 비 빼 드리다 편하다 디엠 줄다
791,뱅 드림 합동 라이브 공연 티켓 하 구미 운 밉다 파다 교환 환불 안되다
792,뱅 드림 일 도리 한정 페스 돌다 계정 판매 양도 쿨 스파 레 투 페스 한정 만 돌 즉입 판매 하다 스토리 미열 람
793,뱅 드림 애프터 글 로우 아오 바 모카 미타 케 란 모카 란 굿 즈 여러 개 판매 하다 사진 속 조건 보시 맞다 디엠 줄다 다수 거래 우대 하다 여러 개 사시 반택 비 빼 드리다
794,뱅 드림 마루 야마 아야 위주 캔 뱃지 판매 하다 일괄 개별 구매 하다 때 아야 개 다른 멤버 뱃지 개 데려가다 하다 이브 아크릴 스티커 예 용 파스 파레 우 다가오다 아코 붉다 날개 위고 토 야마 카 스미다 필
795,나 어리다 때 그림 연습 걸 함 앙 스타 뱅 드림 방법 남캐 잘 그리다 앙 스타 이르다 내 그림 체 그리기 번 여캐 잘 그리다 뱅 드림 이르다 내 그림 체 그리기 번 그래서 진짜 하다 물어보다 두다 합치다 번
796,뱅 드림 포핀파 슈발츠 뱅 가드 장 일괄 판매 하다 애니메이트 월드 페어 특전 플라워 카 스미다 포함 토 야마 카 스미다 야마 부키 사 아야 이 치가 아리사 우시 메 리미 하나조노 타 포 피파 포핀 파티 포카 앨
797,뱅 드림 앱글 슈발츠 장 일괄 판매 하다 왼쪽 네 장 홀로그램 애니메이트 특전 모카 스티커 같이 드리다 애프터 글 로우 미타 케 란 아오 바 모 우 다가오다 토모 우 하라 히 마리 하자 츠 구미 아크릴
798,뱅 드림 장터 뱅 드림 시로 카 린코 테루테루 보 오즈 테루테루보즈 판매 하다 ㅅㅊㅇ 뱅 드림 반 도리 굿 즈 시로 카 린코 미나토 유키나 우 다가오다 아코 히 카 사 이마이 리사 로젤리아 로젤 굿 즈
799,뱅 드림 굿 즈 앱글 애프터 글 로우 하자 츠 구미 아크릴 핀 즈 판매 양 도합 니 마음 후 디엠 줄다 반택 편택
800,특전 안내 매장 내 뱅 드림 관련 굿 즈 를 구매 하다 만원 당 밴드 특제 스티커 종 중 종 랜덤 증정 기간 월 일금 소진 시 장소 애니플러스 샵 카운터 방 도리 포핀파 애프터 그로
801,뱅 드림 로젤리아 에피소드 약속 애니플러스 일일 수량 한정 주차 한정 메뉴 약속 머그컵 세트 블루베리 라임 이드 머그컵 예약 링크 안내 주차 예약 월 일일 낮 시
802,사실 럽라 뱅 드림 전체 보컬 비 하다
803,커버 곡 천재 아이돌 자랑 하다 뱅 드림 마루 야마 아야
804,뱅 드림 뱅 드림 아리사 조아하다 잇다 굿 즈 소소하다 모으다 게임 하다 잇다 친해지다 같이 뱅 드림 해 저 도모 닷 치 하다 자다 맞다 분만 무 메다 팔로 찾아가다 맞괄 꼬
805,프리 채널 판 정도 하다 오다 아니다 프세카 뱅 드림 엄청 돌리다 고민 이다
806,나 어리다 때 그림 연습 걸 함 앙 스타 뱅 드림 방법 남캐 잘 그리다 앙 스타 이르다 내 그림 체 그리기 번 여캐 잘 그리다 뱅 드림 이르다 내 그림 체 그리기 번 그래서 진짜 하다 물어보다 두다 합치다 번
807,뱅 드림 장터 뱅 드림 슈발츠 일괄 양 도합 니 미사 키 슈발츠 홀로그램 이다 헬로 해피 미셸 카논 타 이브 바이스 슈발츠 뱅 가드 아크릴 굿 즈 뱃지 별 뱃지 레어 팝핀 파 파스 파레 위고 홀리데이 특전
808,뱅 드림 일일 카페 수요 조사 주인 님 들다 모시다 인수 메이드 로젤리아 궁금하다 않다 가요 특별하다 대접 하다 드리다 어서 오다 주인 님 년 봄 계최 예정 한 타임 진행 손님
809,뱅 드림 앱글 슈발츠 장 일괄 판매 하다 왼쪽 네 장 홀로그램 애니메이트 특전 모카 스티커 같이 드리다 애프터 글 로우 미타 케 란 아오 바 모 우 다가오다 토모 우 하라 히 마리 하자 츠 구미 아크릴
810,뱅 드림 포핀파 슈발츠 뱅 가드 장 일괄 판매 하다 애니메이트 월드 페어 특전 플라워 카 스미다 포함 토 야마 카 스미다 야마 부키 사 아야 이 치가 아리사 우시 메 리미 하나조노 타 포 피파 포핀 파티 포카 앨
811,뱅 드림 마루 야마 아야 위주 캔 뱃지 판매 하다 일괄 개별 구매 하다 때 아야 개 다른 멤버 뱃지 개 데려가다 하다 이브 아크릴 스티커 예 용 파스 파레 우 다가오다 아코 붉다 날개 위고 토 야마 카 스미다 필
812,뱅 드림 헬로 해피 헬햎 세타 카오루 포토 카드 백스테 스티커 판매 양 도합 니 백스테 스티커 포카 개다 고 전체 일 괄시 반택 비 빼 드리다 편하다 디엠 줄다
813,러브라이브 천사 님 러브라이브 개인 봇 프로 세카 천사 님 프로 세카 개인 봇 지하 군 천사 님 지하 군 개인 봇 뱅 드림 천사 님 뱅 드림 개인 봇 러브라이브 천사 님 러브라이브 개인 봇 프로 세카 천사 님 프로 세카 개인 봇
814,뱅 드림 파스 파레 마루 야마 아야 봄 고하 자막
815,뱅 드림 접다 싶다
816,나 어리다 때 그림 연습 걸 함 앙 스타 뱅 드림 방법 남캐 잘 그리다 앙 스타 이르다 내 그림 체 그리기 번 여캐 잘 그리다 뱅 드림 이르다 내 그림 체 그리기 번 그래서 진짜 하다 물어보다 두다 합치다 번
817,뱅 드림 아야 코스 안 하다 걸리다 월 서코 때 보다 보고 싶다
818,비계 팅 투디 일상 계 용 프 세카 뱅 드림 하다 분 환영
819,팔리다 추첨 덕 자 만원 드리다 뱅 드림 일 도리 은퇴 계 양도 판매 하다 찐완햎 피파 쿨 하피 완덱퓨젤 퓨니카 햎글 파츠 쿨 피파 불 스파 레 쿨글 파츠 불글 퓨글 불 피파 쿨젤 퓨 하피 햎로 하피
820,저 사실 게임 자다 안 해 하다 게임 앙 스타 프로 세카 뱅 드림 이 개 없다
821,뱅 드림 아오 바 모카 주년 아크릴 스탠드 공구 양도 하다 배송지 변경 차금 해배 비국배비 포함 양도 하다
822,뱅 드림 죽다 못 버리다 리사 사랑 하다 리사 사랑 하다 유키나 동거 결혼 혼인신고 서도 작성 하다 ㅠㅠ
823,사퍼 뱅 드림 본진 이다 서울 인천 주로 출몰 하다 뭔가 낮 익다 트친 츄 라이 츄 라이 흔적 남기다 ㅌㅊㅅ
824,나 어리다 때 그림 연습 걸 함 앙 스타 뱅 드림 방법 남캐 잘 그리다 앙 스타 이르다 내 그림 체 그리기 번 여캐 잘 그리다 뱅 드림 이르다 내 그림 체 그리기 번 그래서 진짜 하다 물어보다 두다 합치다 번
825,사퍼 뱅 드림 본진 이다 서울 인천 주로 출몰 하다 뭔가 낮 익다 트친 츄 라이 츄 라이 흔적 남기다 ㅌㅊㅅ
826,뱅 드림 애프터 글 로우 아오 바 모카 미타 케 란 모카 란 굿 즈 여러 개 판매 하다 사진 속 조건 보시 맞다 디엠 줄다 다수 거래 우대 하다 여러 개 사시 반택 비 빼 드리다
827,사퍼 뱅 드림 본진 이다 서울 인천 주로 출몰 하다 뭔가 낮 익다 트친 츄 라이 츄 라이 흔적 남기다 ㅌㅊㅅ
828,사퍼 뱅 드림 본진 이다 서울 인천 주로 출몰 하다 뭔가 낮 익다 트친 츄 라이 츄 라이 흔적 남기다 ㅌㅊㅅ
829,뱅 드림 뱅 드림 아리사 조아하다 잇다 굿 즈 소소하다 모으다 게임 하다 잇다 친해지다 같이 뱅 드림 해 저 도모 닷 치 하다 자다 맞다 분만 무 메다 팔로 찾아가다 맞괄 꼬
830,나 뱅 드림 계정 날림 ㅠㅠㅠㅠㅠㅠㅠㅠㅠㅠㅠ 하 안 돼다 내 갸루 리사 ㅠㅠㅠㅠ
831,사퍼 뱅 드림 본진 이다 서울 인천 주로 출몰 하다 뭔가 낮 익다 트친 츄 라이 츄 라이 흔적 남기다 ㅌㅊㅅ
832,드 친소 뱅 드림 장르 연인 드림 중심 다드 림 하다 장르 상관 없이 같이 즐겁다 드림 이야기 하다 분 찾다 흔적 남기다 천천히 찾아가다
833,콤보 안 깨지다 아이돌 모든 것 신나다 즐기다 보다 왜 이렇다 얘기 하다 뱅 드림 프로 세카 굿 콤보 깨지다
834,뱅 드림 이브 란 슈발츠 카드 일괄 양 도합 니 준 밉다 포 가격 이다 반택 가능하다
835,뱅 드림 뱅 드림 아리사 조아하다 잇다 굿 즈 소소하다 모으다 게임 하다 잇다 친해지다 같이 뱅 드림 해 저 도모 닷 치 하다 자다 맞다 분만 무 메다 팔로 찾아가다 맞괄 꼬
836,뱅 드림 뱅 드림 아리사 조아하다 잇다 굿 즈 소소하다 모으다 게임 하다 잇다 친해지다 같이 뱅 드림 해 저 도모 닷 치 하다 자다 맞다 분만 무 메다 팔로 찾아가다 맞괄 꼬
837,뱅 드림
838,안녕하다 저희 아이즈 하다 애니 송 커버 밴드 이다 이번 월일 토요일 부산 대 무 몽크 뱅 드림 커버 공연 준비 홍보 위 하다 저희 합주 영상 준비 해오다 풀 영상 궁
839,뱅 드림 뱅 드림 아리사 조아하다 잇다 굿 즈 소소하다 모으다 게임 하다 잇다 친해지다 같이 뱅 드림 해 저 도모 닷 치 하다 자다 맞다 분만 무 메다 팔로 찾아가다 맞괄 꼬
840,뱅 드림 걸즈 밴드 파티 미타 케 란 밴드 기타 보컬 담당 하다 차갑다 보이 친구 들 아끼다 마음씨 좋다 친구 해 단 음식 싫어하다 하다
841,뱅 드림 일 도리 퓨 라스 찐완덱 계정 판매 만 돌 곡 미만 진행 도리 베다 수영복 의상 포보 오다 크다 할로윈 롯카 카 스미다 보유 도리 베다 칭호 핀 즈 오다 크다 보유 즉입 가능하다 때 연락
